{
  "$schema": "https://json-schema.org/draft/2020-12/schema",
  "title": "explain-diff payload",
  "type": "object",
  "required": ["title", "verdict", "mode", "diff", "sections"],
  "additionalProperties": false,
  "properties": {
    "title": { "type": "string", "minLength": 1 },
    "verdict": { "type": "string", "minLength": 1 },
    "mode": { "enum": ["warm", "cold"] },
    "diff": { "type": "string", "minLength": 1, "description": "Git range (e.g. 'main...HEAD') or 'WORKTREE'" },
    "sections": {
      "type": "array",
      "minItems": 1,
      "items": {
        "oneOf": [
          { "$ref": "#/$defs/narrative" },
          { "$ref": "#/$defs/diagram" },
          { "$ref": "#/$defs/decision" },
          { "$ref": "#/$defs/hunk" },
          { "$ref": "#/$defs/comparison" },
          { "$ref": "#/$defs/question" },
          { "$ref": "#/$defs/fallout" }
        ]
      }
    }
  },
  "$defs": {
    "md": { "type": "string", "minLength": 1 },
    "ident": { "type": "string", "pattern": "^[a-z][a-z0-9_-]*$" },
    "narrative": {
      "type": "object",
      "required": ["type", "heading", "md"],
      "additionalProperties": false,
      "properties": {
        "type": { "const": "narrative" },
        "heading": { "type": "string", "minLength": 1 },
        "md": { "$ref": "#/$defs/md" }
      }
    },
    "diagram": {
      "type": "object",
      "required": ["type", "heading", "mermaid"],
      "additionalProperties": false,
      "properties": {
        "type": { "const": "diagram" },
        "heading": { "type": "string", "minLength": 1 },
        "mermaid": { "type": "string", "minLength": 1 },
        "links": {
          "type": "object",
          "additionalProperties": { "type": "string", "pattern": "^#" }
        }
      }
    },
    "decision": {
      "type": "object",
      "required": ["type", "id", "title", "provenance", "reversal_cost", "md"],
      "additionalProperties": false,
      "properties": {
        "type": { "const": "decision" },
        "id": { "$ref": "#/$defs/ident" },
        "title": { "type": "string", "minLength": 1 },
        "provenance": { "enum": ["stated", "inferred"] },
        "reversal_cost": { "enum": ["low", "medium", "high"] },
        "md": { "$ref": "#/$defs/md" },
        "alternatives": { "type": "array", "items": { "type": "string" } }
      }
    },
    "hunk": {
      "type": "object",
      "required": ["type", "file", "lines", "ref", "md"],
      "additionalProperties": false,
      "properties": {
        "type": { "const": "hunk" },
        "file": { "type": "string", "minLength": 1 },
        "lines": { "type": "string", "pattern": "^[0-9]+-[0-9]+$" },
        "ref": { "type": "string", "minLength": 1, "description": "git ref, or WORKTREE for on-disk state" },
        "md": { "$ref": "#/$defs/md" },
        "sha256": { "type": "string" }
      }
    },
    "comparison": {
      "type": "object",
      "required": ["type", "heading", "before_md", "after_md"],
      "additionalProperties": false,
      "properties": {
        "type": { "const": "comparison" },
        "heading": { "type": "string", "minLength": 1 },
        "before_md": { "$ref": "#/$defs/md" },
        "after_md": { "$ref": "#/$defs/md" }
      }
    },
    "question": {
      "type": "object",
      "required": ["type", "id", "md"],
      "additionalProperties": false,
      "properties": {
        "type": { "const": "question" },
        "id": { "$ref": "#/$defs/ident" },
        "md": { "$ref": "#/$defs/md" }
      }
    },
    "fallout": {
      "type": "object",
      "required": ["type", "items"],
      "additionalProperties": false,
      "properties": {
        "type": { "const": "fallout" },
        "heading": { "type": "string" },
        "items": { "type": "array", "minItems": 1, "items": { "type": "string" } }
      }
    }
  }
}
